{
  "$schema": "../schema/no.schema.json",
  "id": "copilot",
  "kind": "tela",
  "titulo": "copilot",
  "rota": "/cosmos/copilot",
  "componente": "apps/app/components/cosmos/screens/copilot.tsx",
  "registro": "apps/app/components/cosmos/screens/registry.tsx",
  "balde": null,
  "profundidade": null,
  "trilha": null,
  "dono": null,
  "estado": "pendente",
  "actions": [],
  "models": [],
  "lacunas": [],
  "depende_de": [],
  "seed": [],
  "verifica": [],
  "commits": []
}
